filename;section;text;light
001.rtf;common;Коммерческий агент относится к категории технических исполнителей.;False
001.rtf;common;На должность коммерческого агента назначается лицо, имеющее среднее профессиональное образование и специальная подготовка по установленной программе без предъявления требований к стажу работы.;False
001.rtf;common;Назначение на должность коммерческого агента и освобождение от нее производится приказом директора предприятия.;True
001.rtf;common;Коммерческий агент должен знать:;False
001.rtf;common;Нормативные правовые акты, положения, инструкции, другие руководящие материалы и документы, касающиеся ведения бизнеса.;False
001.rtf;common;Основы рыночной экономики.;False
001.rtf;common;Методы установления деловых контактов.;False
001.rtf;common;Порядок оформления документов, связанных с куплей-продажей товаров и заключением договоров, соглашений и контрактов на оказание услуг.;False
001.rtf;common;Основы трудового, финансового хозяйственного  и налогового законодательства.;False
001.rtf;common;Действующие формы учета и отчетности.;False
001.rtf;common;Организацию погрузочно-разгрузочных работ.;False
001.rtf;common;Условия хранения и транспортировки товаров.;False
001.rtf;common;Правила внутреннего трудового распорядка.;False
001.rtf;common;. Правила и нормы охраны труда.;False
001.rtf;common;Коммерческий агент подчиняется непосредственно;False
001.rtf;common;На время отсутствия коммерческого агента (отпуск, болезнь, пр.) его обязанности исполняет лицо, назначенное в установленном порядке. Данное лицо приобретает соответствующие права и несет ответственность за надлежащее их исполнение.;False
001.rtf;tasks;Коммерческий агент:;True
001.rtf;tasks;Участвует в работе по установлению необходимых деловых контактов между покупателями и продавцами товаров, включая техническую и другую продукцию (оборудование, сырье, полуфабрикаты и др.), а также оказанию различных коммерческих услуг.;True
001.rtf;tasks;Содействует покупке и продаже партий товаров (оптом), а также театральной, музыкальной и других видов творческой продукции (постановка представлений, выступление артистов, спортсменов, издание книг, запись музыкальных произведений и др.).;True
001.rtf;tasks;Обеспечивает надлежащее оформление заключаемых договоров и контрактов, других необходимых документов, в том числе страховых  и экспортных лицензий.;True
001.rtf;tasks;Выполняет необходимую техническую работу при заключении соглашений, договоров и контрактов, размещении рекламы в средствах массовой информации.;True
001.rtf;tasks;Организует предоставление транспортных средств и обеспечение выполнения других условий, предусмотренных заключенными соглашениями, договорами и контрактами, оказывает помощь в доставке товаров.;False
001.rtf;rights;Коммерческий агент имеет право:;False
001.rtf;rights;Знакомиться с проектами решений руководства предприятия, касающихся его деятельности.;False
001.rtf;rights;Запрашивать лично или по поручению непосредственного руководителя от руководителей подразделений предприятия и специалистов информацию и документы, необходимые для выполнения его должностных обязанностей.;False
001.rtf;rights;Вносить на рассмотрение руководства предложения по совершенствованию работы, связанной с предусмотренными настоящей инструкцией обязанностями.;False
001.rtf;rights;В пределах своей компетенции сообщать своему непосредственному руководителю о всех выявленных в процессе своей деятельности недостатках и вносить предложения по их устранению.;False
001.rtf;rights;Требовать от руководства предприятия оказания содействия в исполнении им его должностных обязанностей и прав.;False
001.rtf;respons;Коммерческий агент несет ответственность:;False
001.rtf;respons;За ненадлежащее исполнение или неисполнение своих должностных обязанностей, предусмотренных настоящей должностной инструкцией - в пределах, определенных действующим трудовым законодательством Российской Федерации.;False
001.rtf;respons;За правонарушения, совершенные в процессе осуществления своей деятельности - в пределах, определенных действующим административным, уголовным и гражданским законодательством Российской Федерации.;False
001.rtf;respons;За причинение материального ущерба - в пределах, определенных действующим трудовым и гражданским законодательством Российской Федерации.;False
002.rtf;common;Агент по закупкам относится к категории технических исполнителей.;False
002.rtf;common;На должность агента по закупкам назначается лицо, имеющее среднее (полное) общее образование и специальная подготовка по установленной программе без предъявления требований к стажу работы.;False
002.rtf;common;Назначение на должность агента по закупкам и освобождение от нее;False
002.rtf;common;производится приказом директора предприятия по представлению;False
002.rtf;common;"(заведующего объектом торговли; заведующего объектом торговли; )";False
002.rtf;common;Агент по закупкам должен знать:;False
002.rtf;common;Нормативные правовые акты, положения, инструкции, другие руководящие материалы и документы, касающиеся порядка заключения договоров с поставщиками.;False
002.rtf;common;Основы рыночной экономики.;False
002.rtf;common;Основы трудового, финансового и хозяйственного законодательства.;False
002.rtf;common;Методы делового общения.;False
002.rtf;common;Методы и средства определения качества закупаемой продукции.;False
002.rtf;common;Организацию погрузочно-разгрузочных работ.;False
002.rtf;common;Правила и порядок приемки, отправки и сдачи продукции, заказа контейнеров и транспортных средств.;False
002.rtf;common;Условия хранения и перевозки закупаемой продукции.;False
002.rtf;common;Формы и порядок оформления приемосдаточных документов.;False
002.rtf;common;. Основы организации труда.;False
002.rtf;common;. Правила внутреннего трудового распорядка.;False
002.rtf;common;. Правила и нормы охраны труда.;False
002.rtf;common;Агент по закупкам подчиняется непосредственно;False
002.rtf;common;(заведующему;False
002.rtf;common;"объектом торговли;заведующему складом объекта торговли; иному должностному";False
002.rtf;common;лицу);False
002.rtf;common;На время отсутствия агента по закупкам (отпуск, болезнь, пр.) его обязанности исполняет лицо, назначенное в установленном порядке. Данное лицо приобретает соответствующие права и несет ответственность за надлежащее их исполнение.;False
002.rtf;tasks;Агент по закупкам:;True
002.rtf;tasks;Осуществляет работу по закупке у населения сельскохозяйственной продукции собственного производства в соответствии с заключаемыми договорами, определяющими характер и объем поставок, а также их оплату.;True
002.rtf;tasks;Выезжает в сельскохозяйственные районы, выявляет потенциальных поставщиков (продавцов) производимой ими продукции, заключает договоры купли-продажи.;True
002.rtf;tasks;Проводит разъяснительную работу среди населения о порядке заключения договоров купли-продажи на обоюдно-выгодных условиях, принимает меры по установлению долгосрочных связей с производителями сельскохозяйственной продукции.;True
002.rtf;tasks;Осуществляет контроль качества приобретаемой продукции.;True
002.rtf;tasks;Оформляет в соответствии с установленным порядком документацию на издаваемую продукцию, заказывает контейнеры и транспортные средства для ее перевозки.;True
002.rtf;tasks;Контролирует наличие необходимых приспособлений и санитарное состояние транспортных средств, предназначенных для перевозки, правильность проведения погрузочно-разгрузочных работ и рациональное размещение продукции.;True
002.rtf;tasks;Отправляет закупленную продукцию в адрес поручителя, сопровождает грузы в пути следования, соблюдая санитарные требования и правила хранения продукции при транспортировке, содействует их своевременной доставке.;True
002.rtf;tasks;Следит за соблюдением требований охраны труда при проведении погрузочно-разгрузочных работ.;True
002.rtf;tasks;Сдает доставленную продукцию, оформляет установленную приемосдаточную документацию.;False
002.rtf;rights;Агент по закупкам имеет право:;False
002.rtf;rights;Знакомиться с проектами решений руководства предприятия, касающихся его деятельности.;False
002.rtf;rights;Запрашивать лично или по поручению непосредственного руководителя от руководителей подразделений предприятия и специалистов информацию и документы, необходимые для выполнения его должностных обязанностей.;False
002.rtf;rights;Вносить на рассмотрение руководства предложения по совершенствованию работы, связанной с предусмотренными настоящей инструкцией обязанностями.;False
002.rtf;rights;В пределах своей компетенции сообщать своему непосредственному руководителю о всех выявленных в процессе своей деятельности недостатках и вносить предложения по их устранению.;False
002.rtf;rights;Требовать от руководства предприятия оказания содействия в исполнении им его должностных обязанностей и прав.;False
002.rtf;respons;Агент по закупкам несет ответственность:;False
002.rtf;respons;За ненадлежащее исполнение или неисполнение своих должностных обязанностей, предусмотренных настоящей должностной инструкцией - в пределах, определенных действующим трудовым законодательством Российской Федерации.;False
002.rtf;respons;За правонарушения, совершенные в процессе осуществления своей деятельности - в пределах, определенных действующим административным, уголовным и гражданским законодательством Российской Федерации.;False
002.rtf;respons;За причинение материального ущерба - в пределах, определенных действующим трудовым и гражданским законодательством Российской Федерации.;False
003.rtf;common;Агент по продаже недвижимости относится к категории технических исполнителей.;False
003.rtf;common;На должность агента по продаже недвижимости назначается лицо, имеющее среднее профессиональное образование и специальная подготовка по установленной программе без предъявления требований к стажу работы.;False
003.rtf;common;Назначение на должность агента по продаже недвижимости и освобождение от нее производится приказом директора предприятия.;True
003.rtf;common;Агент по продаже недвижимости должен знать:;False
003.rtf;common;Нормативные правовые акты, положения инструкции, другие руководящие материалы и документы, регулирующие операции с недвижимостью.;False
003.rtf;common;Агентства, работающие на рынке недвижимости, и виды оказываемых ими услуг.;False
003.rtf;common;Основы рыночной экономики.;False
003.rtf;common;Правила установления деловых контактов.;False
003.rtf;common;Условия налогообложения юридических и физических лиц.;False
003.rtf;common;Организацию осуществления операций с недвижимостью.;False
003.rtf;common;Правила и порядок заключения договоров и оформления необходимых документов, связанных с куплей-продажей и арендой недвижимости.;False
003.rtf;common;Методы анализа и порядок сбора, обработки и передачи информации о рынке недвижимости.;False
003.rtf;common;Конъюнктуру рынка недвижимости.;False
003.rtf;common;. Основные требования стандартов, технических, качественных и других характеристик, предъявляемых к объектам недвижимости.;False
003.rtf;common;. Порядок проведения осмотров и методы оценки объектов купли-продажи и аренды.;False
003.rtf;common;. Действующие ценники и прейскуранты.;False
003.rtf;common;. Организацию рекламной работы.;False
003.rtf;common;. Приемы и методы делового общения, ведения переговоров.;False
003.rtf;common;. Основы земельного и жилищного законодательства.;False
003.rtf;common;. Основы экономики, психологии и трудового законодательства.;False
003.rtf;common;. Правила и нормы охраны труда.;False
003.rtf;common;Агент по продаже недвижимости подчиняется непосредственно;False
003.rtf;common;На время отсутствия агента по продаже недвижимости (отпуск, болезнь, пр.) его обязанности исполняет лицо, назначенное в установленном порядке. Данное лицо приобретает соответствующие права и несет ответственность за надлежащее их исполнение.;False
003.rtf;tasks;Агент по продаже недвижимости:;True
003.rtf;tasks;Осуществляет работу по покупке, продаже или аренде недвижимости от имени и по поручению клиентов.;True
003.rtf;tasks;Получает информацию о продаваемом или сдаваемом в аренду имуществе и о требованиях потенциальных покупателей или арендаторов.;True
003.rtf;tasks;Изучает спрос и предложения на рынке недвижимости.;True
003.rtf;tasks;Регистрирует поступающие предложения по продаже или передаче в аренду объектов недвижимости, проводит их ознакомительный осмотр.;True
003.rtf;tasks;В отдельных случаях заключает эксклюзивные договоры между собственниками и агентством.;True
003.rtf;tasks;Осуществляет поиск потенциальных покупателей и арендаторов, устанавливает с ними деловые контакты.;True
003.rtf;tasks;Организует ознакомление покупателей или арендаторов с продаваемым или сдаваемым объектом недвижимости.;True
003.rtf;tasks;Оформляет заявки покупателей, подбирает или предлагает варианты продаж или сдачи внаем.;True
003.rtf;tasks;Согласовывает договорные условия, оформляет операции с недвижимостью.;True
003.rtf;tasks;. Оказывает помощь клиентам в сборе необходимых документов и оформлении сделок.;True
003.rtf;tasks;. Информирует клиентов о поступивших подходящих предложениях, консультирует по вопросам, касающимся характеристики рассматриваемых объектов недвижимости и степени соответствия их определенным требованиям.;True
003.rtf;tasks;. Организует подписание договоров купли-продажи или передаче в аренду объектов недвижимости.;True
003.rtf;tasks;. Содействует своевременному оформлению необходимых клиентам для заключения сделки документов, обеспечивает их сохранность.;True
003.rtf;tasks;. Представляет интересы клиентов для заключения сделки документов, обеспечивает их сохранность.;True
003.rtf;tasks;. Представляет интересы клиентов при осуществлении взаимодействия с другими специалистами агентства и иных учреждений, участвующими в оформлении сделок.;True
003.rtf;tasks;. Составляет установленную отчетность о выполненной работе.;False
003.rtf;rights;Знакомиться с проектами решений руководства предприятия, касающихся его деятельности.;False
003.rtf;rights;Запрашивать лично или по поручению непосредственного руководителя от руководителей подразделений предприятия и специалистов информацию и документы, необходимые для выполнения его должностных обязанностей.;False
003.rtf;rights;Вносить на рассмотрение руководства предложения по совершенствованию работы, связанной с предусмотренными настоящей инструкцией обязанностями.;False
003.rtf;rights;В пределах своей компетенции сообщать своему непосредственному руководителю о всех выявленных в процессе своей деятельности недостатках и вносить предложения по их устранению.;False
003.rtf;rights;Требовать от руководства предприятия оказания содействия в исполнении им его должностных обязанностей и прав.;False
003.rtf;respons;Агент по продаже недвижимости несет ответственность:;False
003.rtf;respons;За ненадлежащее исполнение или неисполнение своих должностных обязанностей, предусмотренных настоящей должностной инструкцией - в пределах, определенных действующим трудовым законодательством Российской Федерации.;False
