filename;section;text;light
012.rtf;common;Действующие стандарты, системы счислений, шифров и кодов.;False
012.rtf;common;Методы программирования.;False
012.rtf;common;Порядок оформления технической документации.;False
012.rtf;common;. Передовой отечественный и зарубежный опыт программирования и использования вычислительной техники.;False
012.rtf;common;. Основы экономики, организации труда и управления.;False
012.rtf;common;. Законодательство о труде и охране труда Российской Федерации.;False
012.rtf;common;. Правила внутреннего трудового распорядка.;False
012.rtf;common;. Правила и нормы охраны труда, техники безопасности, производственной санитарии и противопожарной защиты.;False
012.rtf;common;Администратор баз данных подчиняется непосредственно начальнику отдела информатизации.;True
012.rtf;common;На время отсутствия администратора баз данных (отпуск, болезнь, командировка, пр.) его обязанности исполняет лицо, назначенное в установленном порядке. Данное лицо приобретает соответствующие права и несет ответственность за качественное и своевременное исполнение возложенных на него обязанностей.;False
012.rtf;tasks;Основной задачей администратора баз данных является поддержание в актуальном рабочем состоянии полного объема оперативной и накапливаемой информации, а также защита информации от несанкционированного доступа.;True
012.rtf;tasks;Администратор баз данных в соответствии с возложенной на него задачей выполняет следующие обязанности:;True
012.rtf;tasks;Анализирует информационные потребности структурных подразделений организации.;True
012.rtf;tasks;Осваивает программные средства, предлагаемые отделом информатизации.;True
012.rtf;tasks;Согласовывает с отделом информатизации вопросы по совершенствованию процесса хранения и обработки информации с целью обеспечения требуемой достоверности результатов и минимизации времени расчетов.;True
012.rtf;tasks;Обеспечивает обмен информацией с отделом информатизации в соответствии с установленным порядком (в том числе с использованием электронных сетей телекоммуникаций).;True
012.rtf;tasks;По запросам заинтересованных подразделений организации совместно с отделом информатизации составляет технические задания на разработку программного обеспечения новых задач.;True
012.rtf;tasks;Осуществляет комплекс работ по внедрению программных средств.;True
012.rtf;tasks;Осуществляет систематическое обучение работников организации приемам и навыкам работы на компьютерах, а также работе с внедряемыми программными средствами.;True
012.rtf;tasks;Осуществляет контроль за работой компьютеров и своевременно сообщает о сбоях и неисправностях в отдел информатизации.;True
012.rtf;tasks;Осуществляет учет и хранение документов, имеющих отношение к автоматизированной обработке информации на компьютерах.;True
012.rtf;tasks;. Обобщает и анализирует замечания пользователей по результатам эксплуатации задач и передает информацию об отмеченных недостатках в отдел информатизации.;True
012.rtf;tasks;. Следит за обеспечением целостности, достоверности и сохранности циркулирующих в автоматизированной информационной системе данных.;True
012.rtf;tasks;. Ведет архив используемых программных средств и нормативно-справочной информации.;True
012.rtf;tasks;. Выдает руководству организации рекомендации по распределению между структурными подразделениями поступающей вычислительной техники с учетом наличия программного обеспечения, подготовленных специалистов и анализа загрузки находящихся в эксплуатации ПЭВМ.;False
012.rtf;rights;Администратор баз данных имеет право:;True
012.rtf;rights;Знакомиться с проектами решений руководства предприятия, касающихся его деятельности.;True
012.rtf;rights;"По вопросам, находящимся в его компетенции вносить на рассмотрение своего непосредственного руководителя предложения по улучшению деятельности предприятия и совершенствованию методов обработки информации; замечания по деятельности работников предприятия (отдела); варианты устранения имеющихся в деятельности предприятия (отдела) недостатков.";True
012.rtf;rights;Запрашивать лично или по поручению руководства предприятия от подразделений организации и иных специалистов информацию и документы, необходимые для выполнения его должностных обязанностей.;True
012.rtf;rights;Привлекать специалистов всех (отдельных) структурных подразделений к решению задач, возложенных на него (если это предусмотрено положениями о структурных подразделениях, если нет - то с разрешения руководителей подразделений).;True
012.rtf;rights;Требовать от руководства предприятия (отдела) оказания содействия в исполнении им его должностных обязанностей и прав.;False
012.rtf;respons;Администратор баз данных несет ответственность:;True
012.rtf;respons;За ненадлежащее исполнение или неисполнение своих должностных обязанностей, предусмотренных настоящей должностной инструкцией - в пределах, определенных действующим трудовым законодательством Российской Федерации.;True
012.rtf;respons;За правонарушения, совершенные в процессе осуществления своей деятельности - в пределах, определенных действующим административным, уголовным и гражданским законодательством Российской Федерации.;True
012.rtf;respons;За причинение материального ущерба - в пределах, определенных действующим трудовым и гражданским законодательством Российской Федерации.;False
012.rtf;respons;Администратор баз данных также несет персональную ответственность за:;False
012.rtf;respons;Ненадлежащее выполнение организационно-технических мероприятий, обеспечивающих сохранность информации при сбоях и отказах ПЭВМ.;False
012.rtf;respons;Ненадлежащую организацию защиты информации от несанкционированного доступа.;False
012.rtf;respons;Невыполнение мероприятий, препятствующих заражению ПЭВМ компьютерными вирусами.;False
012.rtf;respons;Разглашение сведений, составляющих государственную, служебную и коммерческую тайну.;False
013.rtf;common;Администратор гостиницы относится к категории специалистов.;False
013.rtf;common;На должность администратора гостиницы назначается лицо, имеющее среднее профессиональное образование без предъявления требований к стажу работы или начальное профессиональное образование и стаж работы по специальности в системе гостиничного обслуживания не менее лет.;False
013.rtf;common;Администратор гостиницы назначается на должность приказом директора гостиницы.;True
013.rtf;common;Администратор гостиницы должен знать:;True
013.rtf;common;Постановления, распоряжения, приказы, другие руководящие и нормативные документы вышестоящих и других органов по вопросам гостиничного обслуживания.;True
013.rtf;common;Правила предоставления гостиничных услуг в Российской Федерации.;True
013.rtf;common;Правила и методы организации процесса обслуживания клиентов.;True
013.rtf;common;Порядок содержания жилых и других помещений гостиницы.;True
013.rtf;common;Основы эстетики, этики, психологии и обслуживания посетителей.;True
013.rtf;common;Основы экономики, организации труда и управления.;True
013.rtf;common;Структуру управления гостиницей, права и обязанности работников гостиницы.;True
013.rtf;common;Законодательство о труде.;True
013.rtf;common;Правила внутреннего распорядка.;True
013.rtf;common;. Правила и нормы охраны труда, техники безопасности, производственной санитарии и противопожарной защиты.;False
013.rtf;common;Администратор гостинцы подчиняется;False
013.rtf;common;"(директору гостиницы; иному";False
013.rtf;common;должностному лицу);False
013.rtf;common;На время отсутствия администратора гостиницы (отпуск, болезнь, пр.) его обязанности исполняет лицо, назначенное приказом директора гостиницы. Данное лицо приобретает соответствующие права и несет ответственность за надлежащее исполнение возложенных на него обязанностей.;False
013.rtf;tasks;Администратор гостиницы:;True
013.rtf;tasks;Обеспечивает работу по эффективному и культурному обслуживанию клиентов, созданию для них комфортных условий.;True
013.rtf;tasks;Осуществляет контроль за своевременной подготовкой номеров к приему прибывающих в гостиницу, соблюдением чистоты в гостинице, регулярной сменой белья в номерах, сохранностью имущества и оборудования.;True
013.rtf;tasks;Информирует проживающих в гостинице о предоставляемых дополнительных платных услугах, принимает заказы на их выполнение и контролирует их исполнение.;True
013.rtf;tasks;Дает устные справки, касающиеся гостиницы, расположения городских достопримечательностей, зрелищных, спортивных сооружений и т.д.;True
013.rtf;tasks;Принимает и оформляет необходимые документы.;True
013.rtf;tasks;Осуществляет контроль за исполнением работниками указаний руководства организации.;True
013.rtf;tasks;Контролирует соблюдение работниками организации трудовой и производственной дисциплины, правил и норм охраны труда, техники безопасности, требований производственной санитарии и гигиены.;True
013.rtf;tasks;Принимает меры к разрешению конфликтов, возникающих при обслуживании проживающих.;True
013.rtf;tasks;Рассматривает претензии, связанные с неудовлетворительным обслуживанием клиентов и проводит соответствующие организационно-технические мероприятия.;True
013.rtf;tasks;. Информирует руководство организации об имеющихся недостатках в обслуживании клиентов, принимает меры к их ликвидации.;False
013.rtf;rights;Администратор гостиницы вправе:;True
013.rtf;rights;Знакомиться с проектами решений руководства гостиницы, касающимися его деятельности.;True
013.rtf;rights;Вносить на рассмотрение руководства предложения по совершенствованию работы, связанной с предусмотренными настоящей инструкцией обязанностями.;True
013.rtf;rights;В пределах своей компетенции сообщать своему непосредственному руководителю о всех выявленных в процессе осуществления должностных обязанностей недостатках в деятельности гостиницы (ее структурных подразделениях) и вносить предложения по их устранению.;True
013.rtf;rights;Запрашивать лично или по поручению своего непосредственного руководителя от специалистов и исполнителей информацию и документы, необходимые для выполнения его должностных обязанностей.;True
013.rtf;rights;Привлекать специалистов всех (отдельных) структурных подразделений к решению задач, возложенных на него (если это предусмотрено положениями о структурных подразделениях, если нет - то с разрешения директора гостиницы).;True
013.rtf;rights;Требовать от руководства гостиницы оказания содействия в исполнении своих должностных обязанностей и прав.;False
013.rtf;respons;Администратор гостиницы несет ответственность:;True
013.rtf;respons;За ненадлежащее исполнение или неисполнение своих должностных обязанностей, предусмотренных настоящей должностной инструкцией - в пределах, определенных действующим трудовым законодательством Российской Федерации.;True
013.rtf;respons;За правонарушения, совершенные в процессе осуществления своей деятельности - в пределах, определенных действующим административным, уголовным и гражданским законодательством Российской Федерации.;True
013.rtf;respons;За причинение материального ущерба - в пределах, определенных действующим трудовым и гражданским законодательством Российской Федерации.;False
014.rtf;common;Администратор зала относится к категории специалистов.;False
014.rtf;common;На должность администратора зала назначается лицо, имеющее среднее профессиональное образование без предъявления требований к стажу работы или начальное профессиональное образование и стаж работы по специальности в системе общественного питания не менее лет.;False
014.rtf;common;Назначение на должность администратора зала и освобождение от нее;False
014.rtf;common;производится приказом директора предприятия по представлению;False
014.rtf;common;(директора;False
014.rtf;common;"ресторана; иного должностного лица)";False
014.rtf;common;Администратор зала должен знать:;False
014.rtf;common;Постановления, распоряжения, приказы, другие руководящие и нормативные документы вышестоящих и других органов, касающиеся организации общественного питания.;False
014.rtf;common;Правила производства и реализации продукции (услуг) общественного питания.;False
014.rtf;common;Организацию производства и управления предприятием общественного питания, задачи и функции его подразделений.;False
014.rtf;common;Правила и методы организации процесса обслуживания посетителей.;False
014.rtf;common;Ассортимент реализуемых услуг.;False
014.rtf;common;Основы маркетинга.;False
014.rtf;common;Экономику общественного питания.;False
014.rtf;common;Порядок ценообразования.;False
014.rtf;common;Принципы планировки и оформления помещений, витрин, организации рекламы.;False
014.rtf;common;Основы эстетики, этики, психологии и обслуживания посетителей.;False
014.rtf;common;. Передовой отечественный и зарубежный опыт организации общественного питания и обслуживания посетителей.;False
014.rtf;rights;. Организацию оплаты и стимулирования труда.;False
014.rtf;rights;. Законодательство о труде.;False
014.rtf;rights;. Правила внутреннего трудового распорядка.;False
014.rtf;rights;. Правила и нормы охраны труда.;False
014.rtf;rights;Администратор зала подчиняется;False
014.rtf;rights;"(директору ресторана; иному";False
014.rtf;rights;должностному лицу);False
014.rtf;rights;На время отсутствия администратора зала (отпуск, болезнь, пр.) его обязанности исполняет лицо, назначенное приказом директора организации. Данное лицо приобретает соответствующие права и несет ответственность за надлежащее исполнение возложенных на него обязанностей.;False
014.rtf;rights;Администратор зала вправе:;True
014.rtf;rights;Знакомиться с проектами решений руководства предприятия, касающимися его деятельности.;True
014.rtf;rights;Вносить на рассмотрение руководства предложения по совершенствованию работы, связанной с предусмотренными настоящей инструкцией обязанностями.;False
014.rtf;rights;В пределах своей компетенции сообщать;False
014.rtf;rights;о всех выявленных в процессе осуществления должностных обязанностей недостатках в деятельности предприятия (его структурных подразделениях) и вносить предложения по их устранению.;False
014.rtf;rights;Привлекать специалистов всех (отдельных) структурных подразделений к решению задач, возложенных на него (если это предусмотрено положениями о структурных подразделениях, если нет - то с разрешения руководства).;False
014.rtf;rights;Требовать от руководства предприятия оказания содействия в исполнении своих должностных обязанностей и прав.;False
014.rtf;tasks;Администратор зала:;True
014.rtf;tasks;Обеспечивает работу по эффективному и культурному обслуживанию посетителей ресторана, созданию для них комфортных условий.;True
014.rtf;tasks;Консультирует посетителей по вопросам предоставления услуг обеспечивает их ознакомление с ассортиментом имеющихся в наличии блюд и напитков.;True
014.rtf;tasks;Осуществляет контроль за рациональным оформлением зала, барных стоек, витрин, и т.д.;True
014.rtf;tasks;Обеспечивает чистоту и порядок в зале.;True
014.rtf;tasks;Контролирует прием заказов официантами от посетителей.;True
014.rtf;tasks;Осуществляет проверку выписанных счетов и производство расчетов с посетителями.;True
014.rtf;tasks;Принимает меры к предотвращению и ликвидации конфликтных ситуаций.;True
