filename;section;text;light
003.rtf;respons;За правонарушения, совершенные в процессе осуществления своей деятельности - в пределах, определенных действующим административным, уголовным и гражданским законодательством Российской Федерации.;False
003.rtf;respons;За причинение материального ущерба - в пределах, определенных действующим трудовым и гражданским законодательством Российской Федерации.;False
004.rtf;common;Агент по розыску грузов относится к категории технических исполнителей.;False
004.rtf;common;На должность агента по розыску грузов назначается лицо, имеющее среднее;False
004.rtf;common;(полное) общее образование;False
004.rtf;common;(специальную подготовку по установленной;False
004.rtf;common;"программе;стаж работы в должности по приему и сдаче грузов: не менее года; не";False
004.rtf;common;менее лет);False
004.rtf;common;или среднее профессиональное (техническое) образование и специальную подготовку по установленной программе.;False
004.rtf;common;Назначение на должность и освобождение от нее производится приказом;False
004.rtf;common;директора предприятия по представлению;False
004.rtf;common;Агент по розыску грузов должен знать:;False
004.rtf;common;Правила перевозок грузов и багажа.;False
004.rtf;common;Методику розыска грузов.;False
004.rtf;common;Формы грузовых перевозочных документов.;False
004.rtf;common;Инструкцию по ведению коммерческой отчетности.;False
004.rtf;common;Схему соответствующей транспортной сети.;False
004.rtf;common;Основные маршруты следования транспорта и пункты перевозки грузов и багажа.;False
004.rtf;common;Основы трудового законодательства.;False
004.rtf;common;Правила внутреннего трудового распорядка.;False
004.rtf;common;Положения, инструкции и другие руководящие документы по кругу обязанностей.;False
004.rtf;common;Агент по розыску грузов подчиняется непосредственно;False
004.rtf;common;На время отсутствия агента по розыску грузов (болезнь, отпуск, пр.) его обязанности исполняет лицо, назначенное в установленном порядке. Данное лицо приобретает соответствующие права и несет ответственность за качественное и своевременное выполнение возложенных на него обязанностей.;False
004.rtf;tasks;Агент по розыску грузов:;True
004.rtf;tasks;Производит розыск багажа и грузов по поступившим претензиям.;True
004.rtf;tasks;Оформляет коммерческие акты при разъединении багажа и грузов от документов и несохранности багажа и грузов.;True
004.rtf;tasks;Принимает участие в проверке и готовит донесения о несохранности грузов.;True
004.rtf;tasks;Принимает и обрабатывает входящие и исходящие коммерческие акты, телеграммы, акты комиссионных проверок и экспертизы.;True
004.rtf;tasks;Расследует случаи несохранных перевозок по оперативным донесениям, коммерческим актам, претензиям и искам грузополучателей и грузоотправителей и подготавливает по ним заключения.;True
004.rtf;tasks;Принимает участие в рассмотрении претензий в арбитражных судах.;True
004.rtf;tasks;Оформляет документы на невостребованные получателями багаж и грузы для их реализации.;True
004.rtf;tasks;Ведет книги учета розыска багажа и грузов и регистрации коммерческих актов.;True
004.rtf;tasks;Обеспечивает сохранность, учет и систематизацию бланков строгой отчетности и других документов на несохранные грузы и багаж.;True
004.rtf;tasks;. Подготавливает перевозочные документы для централизованного вывоза и переадресовки грузов.;True
004.rtf;tasks;. Ведет картотеку на несохранные грузы и багаж.;False
004.rtf;rights;Агент по розыску грузов имеет право:;False
004.rtf;rights;Вносить на рассмотрение руководства предложения по совершенствованию работы, связанной с предусмотренными настоящей инструкцией обязанностями.;False
004.rtf;rights;В пределах своей компетенции сообщать своему непосредственному руководителю о всех выявленных в процессе своей деятельности недостатках и вносить предложения по их устранению.;False
004.rtf;rights;Запрашивать лично или по поручению своего непосредственного руководителя от руководителей подразделений предприятия и специалистов информацию и документы, необходимые для выполнения его должностных обязанностей.;False
004.rtf;rights;Требовать от руководства предприятия оказания содействия в исполнении им его должностных обязанностей и прав. Агент по розыску грузов имеет право:;False
004.rtf;rights;Требовать от руководства предприятия оказания содействия в исполнении им его должностных обязанностей и прав.;False
004.rtf;respons;Агент по розыску грузов несет ответственность:;False
004.rtf;respons;За ненадлежащее исполнение или неисполнение своих должностных обязанностей, предусмотренных настоящей должностной инструкцией - в пределах, определенных действующим трудовым законодательством Российской Федерации.;False
004.rtf;respons;За правонарушения, совершенные в процессе осуществления своей деятельности - в пределах, определенных действующим административным, уголовным и гражданским законодательством Российской Федерации.;False
004.rtf;respons;За причинение материального ущерба - в пределах, определенных действующим трудовым и гражданским законодательством Российской Федерации.;False
005.rtf;common;Агент по снабжению относится к категории технических исполнителей.;False
005.rtf;common;На должность агента по снабжению назначается лицо, имеющее среднее (полное) общее образование и специальная подготовка по установленной программе без предъявления требований к стажу работы.;False
005.rtf;common;Назначение на должность агента по снабжению и освобождение от нее;False
005.rtf;common;производится приказом директора предприятия по представлению;False
005.rtf;common;(начальника;False
005.rtf;common;материально-технического снабжения,  заместителя начальника отдела;False
005.rtf;common;"ла материально-технического снабжения; иного должностного лица)";False
005.rtf;common;Агент по снабжению должен знать:;False
005.rtf;common;Нормативные правовые акты, положения, инструкции, другие руководящие материалы и документы, касающиеся вопросов использования материальных ресурсов.;False
005.rtf;common;Основы организации материально-технического обеспечения и погрузочно-разгрузочных работ.;False
005.rtf;common;Правила и порядок приема и отправки грузов, заказа контейнеров и транспортных средств, оформления документов на получаемые и отправляемые грузы.;False
005.rtf;common;Номенклатуру и нормы расхода сырья, материалов и других товарно-материальных ценностей, условия их хранения и транспортировки.;False
005.rtf;common;Основы организации труда.;False
005.rtf;common;Основы законодательства о труде.;False
005.rtf;common;Правила внутреннего трудового распорядка.;False
005.rtf;common;Правила и нормы охраны труда.;False
005.rtf;common;Агент по снабжению подчиняется непосредственно;False
005.rtf;common;(начальнику отдела;False
005.rtf;common;материально-технического снабжения заместителю начальника отдела;False
005.rtf;common;"материально-технического снабжения; иному должностному лицу)";False
005.rtf;common;На время отсутствия агента по снабжению (болезнь, отпуск, пр.) его обязанности исполняет лицо, назначенное в установленном порядке. Данное лицо приобретает соответствующие права и несет ответственность за надлежащее их исполнение.;False
005.rtf;tasks;Агент по снабжению:;True
005.rtf;tasks;Получает по договорам, нарядам и другим документам товарно-материальные ценности (сырье, материалы, оборудование, комплектующие изделия, инвентарь, канцелярские принадлежности и т.п.).;True
005.rtf;tasks;Оформляет документацию на получаемые и отправляемые грузы, заказывает контейнеры, другую тару, а также транспортные средства для их доставки.;True
005.rtf;tasks;Производит внеплановые закупки материалов.;True
005.rtf;tasks;Отправляет товарно-материальные ценности в адрес предприятия или сопровождает грузы в пути следования, обеспечивает сохранность и содействует своевременной их доставки.;True
005.rtf;tasks;Проверяет состояние груза, принимает меры по замене материальных ценностей в случае обнаружения наружного брака.;True
005.rtf;tasks;Определяет режим перевозки скоропортящихся и опасных грузов, следит за соответствием тары перевозимым грузам, размещением грузов при транспортировке, контролирует соблюдение требований техники безопасности при проведении погрузочно-разгрузочных работ.;True
005.rtf;tasks;Принимает меры по повышению эффективности использования материальных ресурсов путем снижения затрат, связанных с их приобретением,;False
005.rtf;rights;Агент по снабжению имеет право:;False
005.rtf;rights;Знакомиться с проектами решений руководства предприятия, касающихся его деятельности.;False
005.rtf;rights;Запрашивать лично или по поручению непосредственного руководителя от руководителей подразделений предприятия и специалистов информацию и документы, необходимые для выполнения его должностных обязанностей.;False
005.rtf;rights;Вносить на рассмотрение руководства предложения по совершенствованию работы, связанной с предусмотренными настоящей инструкцией обязанностями.;False
005.rtf;rights;В пределах своей компетенции сообщать своему непосредственному руководителю о всех выявленных в процессе своей деятельности недостатках и вносить предложения по их устранению.;False
005.rtf;rights;Требовать от руководства предприятия оказания содействия в исполнении им его должностных обязанностей и прав.;False
005.rtf;respons;Агент по снабжению несет ответственность:;False
005.rtf;respons;За ненадлежащее исполнение или неисполнение своих должностных обязанностей, предусмотренных настоящей должностной инструкцией - в пределах, определенных действующим трудовым законодательством Российской Федерации.;False
005.rtf;respons;За правонарушения, совершенные в процессе осуществления своей деятельности - в пределах, определенных действующим административным, уголовным и гражданским законодательством Российской Федерации.;False
005.rtf;respons;За причинение материального ущерба - в пределах, определенных действующим трудовым и гражданским законодательством Российской Федерации.;False
006.rtf;common;Рекламный агент относится к категории технических исполнителей.;False
006.rtf;common;На должность рекламного агента назначается лицо, имеющее среднее (полное) общее образование и специальную подготовку по установленной программе без предъявления требований к стажу работы.;False
006.rtf;common;Назначение на должность рекламного агента и освобождение от нее;False
006.rtf;common;производится приказом директора предприятия по представлению;False
006.rtf;common;(менеджера по;False
006.rtf;common;"рекламе; руководителя соответствующего структурного подразделения; иного";False
006.rtf;common;должностного лица);False
006.rtf;common;Рекламный агент должен знать:;False
006.rtf;common;Нормативные правовые акты, положения инструкции, другие руководящие материалы, касающиеся рекламной деятельности.;False
006.rtf;common;Законодательство о рекламе.;False
006.rtf;common;Виды рекламы и основы организационной рекламной деятельности.;False
006.rtf;common;Перспективы развития предприятия, производящего рекламируемую продукцию и оказывающего рекламируемые услуги.;False
006.rtf;common;Номенклатуру и ассортимент выпускаемой продукции и оказываемых услуг, основные их характеристики.;False
006.rtf;common;Требования потенциальных покупателей к производимой продукции и заказчиков к оказываемым услугам.;False
006.rtf;common;Действующие ценники и прейскуранты.;False
006.rtf;common;Основы организации связи со средствами массовой информации, приемы и методы делового общения и ведения переговоров.;False
006.rtf;common;Методы сбора и подготовки рекламных материалов.;False
006.rtf;common;. Порядок подготовки рекламных кампаний.;False
006.rtf;common;. Основы эстетики, этики, психологии.;False
006.rtf;common;. Основы экономики, организации труда и управления.;False
006.rtf;common;. Правила внутреннего трудового распорядка.;False
006.rtf;common;. Правила и нормы охраны труда.;False
006.rtf;common;Рекламный агент подчиняется непосредственно;False
006.rtf;common;"(менеджеру по рекламе;";False
006.rtf;common;"руководителю соответствующего структурного подразделения; иному должностному";False
006.rtf;common;лицу);False
006.rtf;common;На время отсутствия рекламного агента (командировка, отпуск, болезнь, пр.) его обязанности исполняет лицо, назначенное в установленном порядке, которое приобретает соответствующие права и несет ответственность за надлежащее исполнение возложенных на него обязанностей.;False
006.rtf;tasks;Рекламный агент:;True
006.rtf;tasks;Осуществляет в качестве посредника работу по представлению и продвижению товаров, услуг, коммерческих идей, выполнению комплекса мер, направленных на содействие их реализации или достижение других маркетинговых задач, соблюдая этические нормы рекламирования товаров, услуг.;True
006.rtf;tasks;Заключает договра или соглашения между доверителем и посредником, определяющие характер и объем работ, которые необходимо выполнить за счет и от имени доверителя, а также их оплату по действующим тарифам или условиям договора (соглашения).;True
006.rtf;tasks;Информирует потенциальных покупателей и потребителей о новых товарах, услугах, идеях, раскрывая (не присущие другим) их специфические особенности, о практическом использовании объекта рекламы, убеждая их, что именно этот товар, услуга, идея ему нужны.;True
006.rtf;tasks;При проведении рекламной работы ссылается на мнения престижного покупателя или потребителя, учитывает платежеспособность различных групп населения.;True
006.rtf;tasks;Составляет и представляет в установленные сроки отчетность.;True
006.rtf;tasks;Стимулирует потребителя повторно делать покупки товара и обращаться за услугами.;True
006.rtf;tasks;Выделяет объект рекламы из массы сообщений, циркулирующих в средствах массовой информации, характеризует его дополнительно отличительными потребительскими качествами, преимуществами на рынке товаров и услуг, создавая спрос и побуждая покупателей и потребителей к заключению сделки.;True
006.rtf;tasks;Принимает меры по обеспечению участия потенциальных покупателей и потребителей в презентациях товаров и услуг, а также проводимых ярмарках, выставках, экскурсиях на предприятия, изготавливающие рекламируемую продукцию.;True
006.rtf;tasks;Осуществляет работу по популяризации предприятия-изготовителя, его коммерческих связей, принципов, положенных в основу его деятельности, направленную на формирование благожелательного отношения покупателей и потребителей и обеспечению престижа рекламодателя.;True
006.rtf;tasks;. Проводит разъяснительную работу среди покупателей и потребителей товаров о гарантиях, правах и способах защиты их интересов.;True
006.rtf;tasks;. Принимает участие в реализации перспективных планов подготовки и размещения рекламы с учетом характера спроса (равномерного или сезонного) на товары (услуги), совершенствовании методов ее проведения,  а также в работе по повышению эффективности и снижению затрат, связанных с рекламой.;True
006.rtf;tasks;. Устанавливает связь со средствами массовой информации по вопросам размещения рекламы.;True
006.rtf;tasks;. Изучает передовой отечественный и зарубежный опыт организации рекламной работы, освоения новых видов рекламы, обеспечивающих выделение и продвижение рекламируемого объекта на рынке товаров и услуг.;True
