filename;section;text;light
006.rtf;tasks;. Осуществляет взаимодействие с другими агентами по рекламе.;True
006.rtf;tasks;. Выполняет отдельные служебные поручения своего непосредственного руководителя.;False
006.rtf;rights;Рекламный агент имеет право:;False
006.rtf;rights;Знакомиться с проектами решений руководства предприятия, касающимися его деятельности.;False
006.rtf;rights;Вносить на рассмотрение руководства предприятия предложения по совершенствованию работы, связанной с предусмотренными настоящей инструкцией обязанностями.;False
006.rtf;rights;В пределах своей компетенции сообщать своему непосредственному руководителю о всех выявленных в процессе своей деятельности недостатках и вносить предложения по их устранению.;False
006.rtf;rights;Запрашивать лично или по поручению непосредственного руководителя от специалистов и исполнителей информацию и документы, необходимые для выполнения его должностных обязанностей.;False
006.rtf;rights;Требовать от руководства предприятия оказания содействия в исполнении своих должностных обязанностей и прав.;False
006.rtf;respons;Рекламный агент имеет несет ответственность:;False
006.rtf;respons;За ненадлежащее исполнение или неисполнение своих должностных обязанностей, предусмотренных настоящей должностной инструкцией - в пределах, определенных действующим трудовым законодательством Российской Федерации.;False
006.rtf;respons;За правонарушения, совершенные в процессе осуществления своей деятельности - в пределах, определенных действующим административным, уголовным и гражданским законодательством Российской Федерации.;False
006.rtf;respons;За причинение материального ущерба - в пределах, определенных действующим трудовым и гражданским законодательством Российской Федерации.;False
007.rtf;common;Страховой агент относится к категории технических исполнителей.;False
007.rtf;common;На должность страхового агента назначается лицо, имеющее среднее профессиональное образование и специальная подготовка по установленной программе без предъявления требований к стажу работы.;False
007.rtf;common;Назначение на должность страхового агента и освобождение от нее производится приказом директора предприятия.;True
007.rtf;common;Страховой агент должен знать:;False
007.rtf;common;Нормативные правовые акты, положения, инструкции, другие руководящие материалы и документы, регламентирующие деятельность страховых органов.;False
007.rtf;common;Виды страховых услуг и условия различных видов страхования.;False
007.rtf;common;Правовые основы развития страховой деятельности с учетом региональных специфических условий.;False
007.rtf;common;Действующую систему социальных гарантий.;False
007.rtf;common;Методы определения степени риска при заключении договоров на страхование услуги и оценки причиненного ущерба.;False
007.rtf;common;Основы рыночной экономики.;False
007.rtf;common;Основы психологии и организации труда.;False
007.rtf;common;Порядок заключения и оформления договоров на страховые услуги.;False
007.rtf;common;Отечественный и зарубежный опыт организации страхования населения и субъектов хозяйствования.;False
007.rtf;common;. Основы трудового законодательства.;False
007.rtf;common;. Правила и нормы охраны труда.;False
007.rtf;common;Страховой агент подчиняется непосредственно;False
007.rtf;common;На время отсутствия страхового агента (отпуск, болезнь, пр.) его обязанности исполняет лицо, назначенное в установленном порядке. Данное лицо приобретает соответствующие права и несет ответственность за надлежащее их исполнение.;False
007.rtf;tasks;Страховой агент:;True
007.rtf;tasks;Осуществляет операции по заключению договоров имущественного и личного страхования.;True
007.rtf;tasks;Изучает региональные условия и спрос на определенные страховые услуги.;True
007.rtf;tasks;Анализирует состав регионального контингента потенциальных клиентов, обслуживает физических лиц, представляющих учреждения, организации и предприятия различных форм собственности.;True
007.rtf;tasks;Проводит аргументированные беседы с потенциальными и постоянными клиентами с целью заинтересовать их в заключении или продлении договоров страхования (жизни и здоровья, движимого и недвижимого имущества, предпринимательской и коммерческой деятельности и др.). в процессе работы с клиентами ведет наблюдение, оценивает особенности восприятия, памяти, внимания, мотивацию поведения и обеспечивает взаимопонимание при заключении договоров на страховые услуги.;True
007.rtf;tasks;Устанавливает критерии и степень риска при заключении договоров на страховые услуги, учитывая состояние здоровья, возраст, пол, образование, стаж трудовой деятельности, уровень материального обеспечения и другие субъективные качества, характеризующие клиента.;True
007.rtf;tasks;Заключает и оформляет страховые договоры, регулирует отношения между страхователем и страховщиком, обеспечивает их выполнение, осуществляет приемку страховых взносов.;True
007.rtf;tasks;Обеспечивает правильность исчисления страховых взносов, оформления страховых документов и их сохранность.;True
007.rtf;tasks;Способствует формированию заинтересованности и спроса на оказываемые страховые услуги, учитывая необходимость усиления материальной и моральной поддержки различных слоев населения, а также нарастание риска, связанного с конкуренцией, банкротством, безработицей и другими происходящими в современных условиях социально- экономическими процессами.;True
007.rtf;tasks;Оказывает помощь клиентам в получении исчерпывающей информации об условиях страхования.;True
007.rtf;tasks;. Проводит работу по выявлению и учету потенциальных страхователей и объектов страхования, дает оценку стоимости объектов страхования.;True
007.rtf;tasks;. В течение срока действия заключенных договоров поддерживает связь с физическими и юридическими лицами, вступившими в договорные отношения на страховые услуги.;True
007.rtf;tasks;. В случае причинения ущерба застрахованному осуществляет оценку и определяет его размер с учетом критериев и степени риска.;True
007.rtf;tasks;. Рассматривает поступающие от клиентов жалобы и претензии по спорным вопросам исчисления и уплаты страховых взносов, выплат страхового возмещения при наступлении страхового случая в соответствии с условиями договора.;True
007.rtf;tasks;. Устанавливает причины нарушений страховых договоров и принимает меры по их предупреждению и устранению.;True
007.rtf;tasks;. Исследует неосвоенные виды страховых услуг и перспективы их развития с целью применения в своей практике и при создании страховых органов и служб.;True
007.rtf;tasks;. Своевременно и в соответствии с установленными требованиями оформляет необходимую документацию, ведет учет и обеспечивает хранение документов,  связанных с заключением договоров страхования.;True
007.rtf;tasks;. Осуществляет взаимодействие с другими страховыми агентами.;False
007.rtf;rights;Страховой агент имеет право:;False
007.rtf;rights;Знакомиться с проектами решений руководства предприятия, касающихся его деятельности.;False
007.rtf;rights;Запрашивать лично или по поручению непосредственного руководителя от руководителей подразделений предприятия и специалистов информацию и документы, необходимые для выполнения его должностных обязанностей.;False
007.rtf;rights;Вносить на рассмотрение руководства предложения по совершенствованию работы, связанной с предусмотренными настоящей инструкцией обязанностями.;False
007.rtf;rights;В пределах своей компетенции сообщать своему непосредственному руководителю о всех выявленных в процессе своей деятельности недостатках и вносить предложения по их устранению.;False
007.rtf;rights;Требовать от руководства предприятия оказания содействия в исполнении им его должностных обязанностей и прав.;False
007.rtf;respons;Страховой агент несет ответственность:;False
007.rtf;respons;За ненадлежащее исполнение или неисполнение своих должностных обязанностей, предусмотренных настоящей должностной инструкцией - в пределах, определенных действующим трудовым законодательством Российской Федерации.;False
007.rtf;respons;За правонарушения, совершенные в процессе осуществления своей деятельности - в пределах, определенных действующим административным, уголовным и гражданским законодательством Российской Федерации.;False
007.rtf;respons;За причинение материального ущерба - в пределах, определенных действующим трудовым и гражданским законодательством Российской Федерации.;False
008.rtf;common;Агент относится к категории технических исполнителей.;False
008.rtf;common;На должность агента назначается лицо, имеющее начальное профессиональное образование без предъявления требований к стажу работы или среднее (полное) общее образование и специальная подготовка по установленной программе без предъявления требований к стажу работы.;False
008.rtf;common;Назначение на должность агента и освобождение от нее производится приказом директора предприятия.;True
008.rtf;common;Агент должен знать:;False
008.rtf;common;Нормативные правовые акты, положения, инструкции, другие руководящие материалы и документы, касающиеся вопросов использования материальных ресурсов.;False
008.rtf;common;Основы организации материально-технического обеспечения и погрузочно-разгрузочных работ.;False
008.rtf;common;Правила и порядок приема и отправки грузов, заказа контейнеров и транспортных средств, оформления документов на получаемые и отправляемые грузы.;False
008.rtf;common;Номенклатуру и нормы расхода сырья, материалов и других товарно-материальных ценностей, условия их хранения и транспортировки.;False
008.rtf;common;Основы организации труда.;False
008.rtf;common;Основы законодательства о труде.;False
008.rtf;common;Правила внутреннего трудового распорядка.;False
008.rtf;common;Правила и нормы охраны труда.;False
008.rtf;common;Агент подчиняется непосредственно;False
008.rtf;common;На время отсутствия агента (отпуск, болезнь, пр.) его обязанности исполняет лицо, назначенное в установленном порядке. Данное лицо приобретает соответствующие права и несет ответственность за надлежащее их исполнение.;False
008.rtf;tasks;Агент:;True
008.rtf;tasks;Получает по нарядам, заявкам и другим документам товарно-материальные ценности (сырье, материалы, оборудование, комплектующие изделия, инвентарь, канцелярские принадлежности и т.п.). оформляет документацию на получаемые и отправляемые грузы, заказывает контейнеры и транспортные средства для их доставки.;True
008.rtf;tasks;В соответствии с устраненным порядком выполняет работу по закупке товарно-материальных ценностей.;True
008.rtf;tasks;Отправляет грузы в адрес предприятий или сопровождает их в пути следования, обеспечивает сохранность и сопровождает их в пути следования, обеспечивает сохранность и содействует своевременной их доставке.;True
008.rtf;tasks;Следит за соблюдением требований охраны труда при проведении погрузочно-разгрузочных работ.;True
008.rtf;tasks;Принимает меры по повышению эффективности использования материальных ресурсов, снижению затрат, связанных с их приобретением, доставкой и хранением.;False
008.rtf;rights;Агент имеет право:;False
008.rtf;rights;Знакомиться с проектами решений руководства предприятия, касающихся его деятельности.;False
008.rtf;rights;Запрашивать лично или по поручению непосредственного руководителя от руководителей подразделений предприятия и специалистов информацию и документы, необходимые для выполнения его должностных обязанностей.;False
008.rtf;rights;Вносить на рассмотрение руководства предложения по совершенствованию работы, связанной с предусмотренными настоящей инструкцией обязанностями.;False
008.rtf;rights;В пределах своей компетенции сообщать своему непосредственному руководителю о всех выявленных в процессе своей деятельности недостатках и вносить предложения по их устранению.;False
008.rtf;rights;Требовать от руководства предприятия оказания содействия в исполнении им его должностных обязанностей и прав.;False
008.rtf;respons;Агент несет ответственность:;False
008.rtf;respons;За ненадлежащее исполнение или неисполнение своих должностных обязанностей, предусмотренных настоящей должностной инструкцией - в пределах, определенных действующим трудовым законодательством Российской Федерации.;False
008.rtf;respons;За правонарушения, совершенные в процессе осуществления своей деятельности - в пределах, определенных действующим административным, уголовным и гражданским законодательством Российской Федерации.;False
008.rtf;respons;За причинение материального ущерба - в пределах, определенных действующим трудовым и гражданским законодательством Российской Федерации.;False
009.rtf;common;Агроном относится к категории специалистов.;False
009.rtf;common;На должность агронома назначается лицо, имеющее;False
009.rtf;common;"(высшее; среднее";False
009.rtf;common;агрономическое образование;False
009.rtf;common;(без предъявления требований к;False
009.rtf;common;"стажу работы;стаж работы по профилю не менее лет)";False
009.rtf;common;Назначение на должность агронома и освобождение от нее производится;False
009.rtf;common;приказом директора организации по представлению;False
009.rtf;common;Агроном должен знать:;False
009.rtf;common;Постановления, распоряжения, приказы, другие руководящие и нормативные документы вышестоящих и других органов, касающиеся вопросов сельскохозяйственного производства и производственно-хозяйственной деятельности отделения (фермы, сельскохозяйственного участка).;False
009.rtf;common;Технологию сельскохозяйственного производства и передовой сельскохозяйственный опыт.;False
009.rtf;common;Методы проведения научных исследований в области агрономии.;False
009.rtf;common;Методы возделывания полевых, садовых, огородных культур.;False
009.rtf;common;Основы экономики, организации производства, труда и управления, системы оплаты труда, материального и морального стимулирования, методы нормирования труда.;False
009.rtf;common;Основы земельного законодательства.;False
009.rtf;common;Законодательство о труде.;False
009.rtf;common;Основы экономики, организации труда, сельскохозяйственного производства и управления.;False
009.rtf;common;Правила внутреннего трудового распорядка.;False
009.rtf;common;. Правила охраны труда, техники безопасности, производственной санитарии и противопожарной защиты.;False
009.rtf;common;Агроном подчиняется непосредственно;False
009.rtf;common;(управляющему отделением;False
009.rtf;common;(фермой,(управляющему отделением (фермой,;False
009.rtf;common;На время отсутствия агронома (командировка, отпуск, болезнь, пр.) его обязанности исполняет лицо, назначенное в установленном порядке. Данное лицо приобретает соответствующие права и несет ответственность за надлежащее выполнение возложенных на него обязанностей.;False
009.rtf;tasks;Агроном:;True
009.rtf;tasks;Проводит научные исследования в области агрономии.;True
009.rtf;tasks;Изучает и внедряет и внедряет передовые методы возделывания полевых, садовых, огородных культур.;True
009.rtf;tasks;Разрабатывает и внедряет технологии по борьбе с вредителями, болезнями растений и сорняками.;True
009.rtf;tasks;Разрабатывает агротехнические мероприятия, направленные на повышение плодородия почв и увеличения урожайности сельскохозяйственных культур.;True
